{
  "format": "txml-api/1",
  "header": "include/txml.h",
  "version": "0.1.0",
  "targets": {
    "x86_64-unknown-linux-gnu": {
      "pointer": {
        "size": 8,
        "align": 8
      },
      "builtins": {
        "char": {
          "size": 1,
          "align": 1
        },
        "bool": {
          "size": 1,
          "align": 1
        },
        "int": {
          "size": 4,
          "align": 4
        },
        "int8_t": {
          "size": 1,
          "align": 1
        },
        "int16_t": {
          "size": 2,
          "align": 2
        },
        "int32_t": {
          "size": 4,
          "align": 4
        },
        "int64_t": {
          "size": 8,
          "align": 8
        },
        "uint8_t": {
          "size": 1,
          "align": 1
        },
        "uint16_t": {
          "size": 2,
          "align": 2
        },
        "uint32_t": {
          "size": 4,
          "align": 4
        },
        "uint64_t": {
          "size": 8,
          "align": 8
        },
        "size_t": {
          "size": 8,
          "align": 8
        }
      }
    },
    "wasm32-unknown-unknown": {
      "pointer": {
        "size": 4,
        "align": 4
      },
      "builtins": {
        "char": {
          "size": 1,
          "align": 1
        },
        "bool": {
          "size": 1,
          "align": 1
        },
        "int": {
          "size": 4,
          "align": 4
        },
        "int8_t": {
          "size": 1,
          "align": 1
        },
        "int16_t": {
          "size": 2,
          "align": 2
        },
        "int32_t": {
          "size": 4,
          "align": 4
        },
        "int64_t": {
          "size": 8,
          "align": 8
        },
        "uint8_t": {
          "size": 1,
          "align": 1
        },
        "uint16_t": {
          "size": 2,
          "align": 2
        },
        "uint32_t": {
          "size": 4,
          "align": 4
        },
        "uint64_t": {
          "size": 8,
          "align": 8
        },
        "size_t": {
          "size": 4,
          "align": 4
        }
      }
    }
  },
  "constants": [
    {
      "name": "TXML_ARENA_CHUNK_DEFAULT",
      "type": {
        "builtin": "size_t"
      },
      "value": 65536
    },
    {
      "name": "TXML_INDEX_NONE",
      "type": {
        "builtin": "uint32_t"
      },
      "value": 4294967295
    },
    {
      "name": "TXML_NAME_NONE",
      "type": {
        "builtin": "uint32_t"
      },
      "value": 4294967295
    },
    {
      "name": "TXML_VERSION",
      "type": {
        "builtin": "int"
      },
      "value": 256
    },
    {
      "name": "TXML_VERSION_MAJOR",
      "type": {
        "builtin": "int"
      },
      "value": 0
    },
    {
      "name": "TXML_VERSION_MINOR",
      "type": {
        "builtin": "int"
      },
      "value": 1
    },
    {
      "name": "TXML_VERSION_PATCH",
      "type": {
        "builtin": "int"
      },
      "value": 0
    }
  ],
  "flag_sets": {
    "txml_attribute_flags": {
      "constants": [
        {
          "name": "TXML_ATTR_NS_DECL",
          "value": 1,
          "symbol": "ns_decl",
          "doc": "xmlns or xmlns:prefix"
        },
        {
          "name": "TXML_ATTR_DEFAULTED",
          "value": 2,
          "symbol": "defaulted",
          "doc": "supplied by an internal-subset ATTLIST default"
        }
      ]
    },
    "txml_node_flags": {
      "constants": [
        {
          "name": "TXML_NODE_EMPTY",
          "value": 1,
          "symbol": "empty",
          "doc": "written as"
        },
        {
          "name": "TXML_NODE_CDATA",
          "value": 2,
          "symbol": "cdata",
          "doc": "text written as a CDATA section; always its own node"
        },
        {
          "name": "TXML_NODE_OPEN",
          "value": 4,
          "symbol": "open",
          "doc": "the end tag has not been parsed yet"
        }
      ]
    },
    "txml_writer_flags": {
      "constants": [
        {
          "name": "TXML_WRITE_DECLARATION",
          "value": 1,
          "symbol": "declaration",
          "doc": "emit < ?xml version=\"1.0\" encoding=\"UTF-8\"?>"
        },
        {
          "name": "TXML_WRITE_INDENT",
          "value": 2,
          "symbol": "indent",
          "doc": "indent element content by depth"
        },
        {
          "name": "TXML_WRITE_EMPTY_TAGS",
          "value": 4,
          "symbol": "empty_tags",
          "doc": "write childless elements as"
        },
        {
          "name": "TXML_WRITE_FRAGMENT",
          "value": 8,
          "symbol": "fragment",
          "doc": "Write a content fragment (XML 1.0 [43] content) instead of a document: text, CDATA and any number of elements may stand at the top level. A fragment has no declaration or DOCTYPE, so combining this flag with TXML_WRITE_DECLARATION is TXML_ERR_INVALID at init."
        }
      ]
    }
  },
  "types": {
    "txml_allocator": {
      "kind": "struct",
      "semantic": "adapter",
      "fields": [
        {
          "name": "self",
          "type": {
            "pointer": {
              "builtin": "void"
            }
          },
          "shape": "raw",
          "direction": "in"
        },
        {
          "name": "v",
          "type": {
            "pointer": {
              "type": "txml_allocator_vtable",
              "const": true
            }
          },
          "shape": "vtable",
          "direction": "in"
        }
      ],
      "layout": {
        "x86_64-unknown-linux-gnu": {
          "size": 16,
          "align": 8,
          "offsets": {
            "self": 0,
            "v": 8
          }
        },
        "wasm32-unknown-unknown": {
          "size": 8,
          "align": 4,
          "offsets": {
            "self": 0,
            "v": 4
          }
        }
      }
    },
    "txml_allocator_free_params": {
      "kind": "struct",
      "doc": "======================================================================== Allocation\n\nThe embedder supplies one allocator. There is no realloc: txml never moves what it has allocated, so every pointer it hands out stays valid until the owning object is destroyed.",
      "fields": [
        {
          "name": "ptr",
          "type": {
            "pointer": {
              "builtin": "void"
            }
          },
          "shape": "raw",
          "direction": "in"
        },
        {
          "name": "size",
          "type": {
            "builtin": "size_t"
          }
        },
        {
          "name": "alignment",
          "type": {
            "builtin": "size_t"
          }
        }
      ],
      "layout": {
        "x86_64-unknown-linux-gnu": {
          "size": 24,
          "align": 8,
          "offsets": {
            "ptr": 0,
            "size": 8,
            "alignment": 16
          }
        },
        "wasm32-unknown-unknown": {
          "size": 12,
          "align": 4,
          "offsets": {
            "ptr": 0,
            "size": 4,
            "alignment": 8
          }
        }
      }
    },
    "txml_allocator_vtable": {
      "kind": "struct",
      "semantic": "vtable",
      "fields": [
        {
          "name": "alloc",
          "type": {
            "pointer": {
              "function": {
                "returns": {
                  "type": {
                    "pointer": {
                      "builtin": "void"
                    }
                  },
                  "shape": "raw"
                },
                "params": [
                  {
                    "name": "self",
                    "type": {
                      "pointer": {
                        "builtin": "void"
                      }
                    },
                    "shape": "raw",
                    "direction": "in"
                  },
                  {
                    "name": "size",
                    "type": {
                      "builtin": "size_t"
                    }
                  },
                  {
                    "name": "alignment",
                    "type": {
                      "builtin": "size_t"
                    }
                  }
                ]
              }
            }
          },
          "shape": "callback",
          "direction": "in",
          "doc": "Return `size` bytes aligned to `alignment`, or NULL."
        },
        {
          "name": "free",
          "type": {
            "pointer": {
              "function": {
                "returns": {
                  "type": {
                    "builtin": "void"
                  }
                },
                "params": [
                  {
                    "name": "self",
                    "type": {
                      "pointer": {
                        "builtin": "void"
                      }
                    },
                    "shape": "raw",
                    "direction": "in"
                  },
                  {
                    "name": "params",
                    "type": {
                      "pointer": {
                        "type": "txml_allocator_free_params",
                        "const": true
                      }
                    },
                    "shape": "single",
                    "direction": "in"
                  }
                ]
              }
            }
          },
          "shape": "callback",
          "direction": "in",
          "doc": "Release a block obtained from alloc(); `params` repeats its size and alignment, so the embedder needs no header of its own."
        }
      ],
      "layout": {
        "x86_64-unknown-linux-gnu": {
          "size": 16,
          "align": 8,
          "offsets": {
            "alloc": 0,
            "free": 8
          }
        },
        "wasm32-unknown-unknown": {
          "size": 8,
          "align": 4,
          "offsets": {
            "alloc": 0,
            "free": 4
          }